{
  "id": "s2",
  "name": "Thriving 50s",
  "description": "Women in their 50s focused on strength, flexibility, and menopause wellness",
  "demographics": "Female, 50-59, health-conscious, active lifestyle",
  "interests": ["Bone health", "Joint mobility", "Menopause support", "Gentle movement"],
  "painPoints": ["Joint pain", "Weight management", "Sleep disruption"],
  "peakTimes": ["Tue 7am", "Thu 10am", "Sun 9am"]
}
